Product Name	Rating	Price	Region	Country
Pasqua Desire Lush Zin Primitivo 202122 Puglia	4.2	9.99	Puglia	Italy
Domini Veneti La Casetta Valpolicella Ripasso DOC Superiore 201819	4.2	15.99	Valpolicella Ripasso	Italy
Definition Barolo DOCG 201718	4.2	18.99	Barolo	Italy
Ramn Bilbao Seleccin Especial Rioja 202021	4.2	8.99	Rioja	Spain
Muga Rioja Reserva 201819	4.2	19.99	Rioja	Spain
Morgenster Lourens River Valley Stellenbosch	4.2	17.99	Stellenbosch	South Africa
Terrazas de los Andes Malbec 202021 Mendoza	4.2	16.99	Mendoza	Argentina
Managers Choice VIK A Cabernet Sauvignon 202021 Cachapoal Valley	4.2	16.99	Cachapoal Valley	Chile
